{
  "$schema": "https://json-schema.org/draft/2020-12/schema",
  "properties": {
    "compat": {
      "type": "object"
    },
    "defaults": {
      "type": "object"
    },
    "families": {
      "type": "object"
    },
    "model_lines": {
      "type": "object"
    },
    "models": {
      "type": "object"
    },
    "modes": {
      "type": "object"
    },
    "version": {
      "type": "integer"
    }
  },
  "required": [
    "version",
    "defaults",
    "families",
    "models"
  ],
  "title": "PrismReel Model Catalog",
  "type": "object"
}
