{
  "compat": {
    "legacy_model_ids": {
      "gemini-3-pro-image": "gemini/gemini-3-pro-image#image",
      "gemini-3.1-flash-image": "gemini/gemini-3.1-flash-image#image",
      "gemini-3.1-flash-lite-image": "gemini/gemini-3.1-flash-lite-image#image",
      "kling-v3-i2v": "kling/kling-v3-video#i2v",
      "kling-v3-r2v": "kling/kling-v3-video#r2v",
      "seedance-2.0-fast-i2v": "seedance/seedance-2.0-fast-video#i2v",
      "seedance-2.0-fast-r2v": "seedance/seedance-2.0-fast-video#r2v",
      "seedance-2.0-fast-t2v": "seedance/seedance-2.0-fast-video#t2v",
      "seedance-2.0-i2v": "seedance/seedance-2.0-video#i2v",
      "seedance-2.0-mini-i2v": "seedance/seedance-2.0-mini-video#i2v",
      "seedance-2.0-mini-r2v": "seedance/seedance-2.0-mini-video#r2v",
      "seedance-2.0-mini-t2v": "seedance/seedance-2.0-mini-video#t2v",
      "seedance-2.0-r2v": "seedance/seedance-2.0-video#r2v",
      "seedance-2.0-t2v": "seedance/seedance-2.0-video#t2v",
      "seedance-2.5-i2v": "seedance/seedance-2.5-video#i2v",
      "seedance-2.5-r2v": "seedance/seedance-2.5-video#r2v",
      "seedance-2.5-t2v": "seedance/seedance-2.5-video#t2v",
      "seedance-2.5-v2v": "seedance/seedance-2.5-video#v2v",
      "vidu/vidu-q3-fast-image": "vidu/vidu/vidu-q3-fast-image#image",
      "vidu/vidu-q3-lite-image": "vidu/vidu/vidu-q3-lite-image#image",
      "viduq3-drama-r2v": "vidu/viduq3-drama-video#r2v",
      "viduq3-pro-i2v": "vidu/viduq3-pro-video#i2v",
      "viduq3-pro-r2v": "vidu/viduq3-pro-video#r2v",
      "viduq3-turbo-i2v": "vidu/viduq3-turbo-video#i2v",
      "viduq3-turbo-r2v": "vidu/viduq3-turbo-video#r2v"
    }
  },
  "defaults": {
    "canonical_model_settings": {
      "i2i_model": "gemini/gemini-3.1-flash-image#image",
      "i2v_model": "seedance/seedance-2.5-video#i2v",
      "image_model": "gemini/gemini-3.1-flash-image#image",
      "r2v_model": "seedance/seedance-2.5-video#r2v",
      "t2i_model": "gemini/gemini-3.1-flash-image#image"
    },
    "model_settings": {
      "i2i_model": "gemini-3.1-flash-image",
      "i2v_model": "seedance-2.5-i2v",
      "image_model": "gemini-3.1-flash-image",
      "r2v_model": "seedance-2.5-r2v",
      "t2i_model": "gemini-3.1-flash-image"
    }
  },
  "families": {
    "gemini": {
      "backend_env_key": null,
      "credential_sources": {
        "google": [
          "GEMINI_API_KEY"
        ]
      },
      "default_backend": "google",
      "display_name": "Gemini Image (Nano Banana)",
      "docs": {
        "official_snapshot_ids": [
          "google/gemini-image/2026-09-08"
        ]
      },
      "family": "gemini",
      "models": [
        "gemini-3-pro-image",
        "gemini-3.1-flash-image",
        "gemini-3.1-flash-lite-image"
      ],
      "provider": "google",
      "routing_prefixes": [
        "gemini-"
      ],
      "supported_backends": [
        "google"
      ],
      "supported_modalities": [
        "t2i",
        "i2i"
      ],
      "transport": {
        "audio_input_mode": {},
        "image_input_mode": {
          "google": "gemini_inline_base64"
        },
        "reference_video_input_mode": {}
      }
    },
    "kling": {
      "backend_env_key": null,
      "credential_sources": {
        "vendor": [
          "KLING_ACCESS_KEY",
          "KLING_SECRET_KEY"
        ]
      },
      "default_backend": "vendor",
      "display_name": "Kling (可灵)",
      "docs": {
        "official_snapshot_ids": [
          "kling/2026-04-25"
        ]
      },
      "family": "kling",
      "models": [
        "kling-v3-i2v",
        "kling-v3-r2v"
      ],
      "provider": "kling",
      "routing_prefixes": [
        "kling-",
        "kling/kling-"
      ],
      "supported_backends": [
        "vendor"
      ],
      "supported_modalities": [
        "t2v",
        "i2v",
        "r2v"
      ],
      "transport": {
        "audio_input_mode": {
          "vendor": "kling_vendor_audio_url"
        },
        "image_input_mode": {
          "vendor": "kling_vendor_base64_image"
        },
        "reference_video_input_mode": {
          "vendor": "kling_vendor_video_url"
        }
      }
    },
    "seedance": {
      "backend_env_key": null,
      "credential_sources": {
        "byteplus": [
          "ARK_API_KEY"
        ]
      },
      "default_backend": "byteplus",
      "display_name": "Seedance (即梦)",
      "docs": {
        "official_snapshot_ids": [
          "byteplus/modelark-seedance/2026-09-02"
        ]
      },
      "family": "seedance",
      "models": [
        "seedance-2.0-fast-i2v",
        "seedance-2.0-fast-r2v",
        "seedance-2.0-fast-t2v",
        "seedance-2.0-i2v",
        "seedance-2.0-mini-i2v",
        "seedance-2.0-mini-r2v",
        "seedance-2.0-mini-t2v",
        "seedance-2.0-r2v",
        "seedance-2.0-t2v",
        "seedance-2.5-i2v",
        "seedance-2.5-r2v",
        "seedance-2.5-t2v",
        "seedance-2.5-v2v"
      ],
      "provider": "byteplus",
      "routing_prefixes": [
        "seedance-2.0-",
        "seedance-2.5-",
        "seedance/seedance-"
      ],
      "supported_backends": [
        "byteplus"
      ],
      "supported_modalities": [
        "t2v",
        "i2v",
        "r2v",
        "v2v"
      ],
      "transport": {
        "audio_input_mode": {},
        "image_input_mode": {
          "byteplus": "byteplus_ark_image_url"
        },
        "reference_video_input_mode": {
          "byteplus": "byteplus_ark_video_url"
        }
      }
    },
    "vidu": {
      "backend_env_key": null,
      "credential_sources": {
        "vendor": [
          "VIDU_API_KEY"
        ]
      },
      "default_backend": "vendor",
      "display_name": "Vidu",
      "docs": {
        "official_snapshot_ids": [
          "vidu/2026-04-25"
        ]
      },
      "family": "vidu",
      "models": [
        "vidu/vidu-q3-fast-image",
        "vidu/vidu-q3-lite-image",
        "viduq3-drama-r2v",
        "viduq3-pro-i2v",
        "viduq3-pro-r2v",
        "viduq3-turbo-i2v",
        "viduq3-turbo-r2v"
      ],
      "provider": "vidu",
      "routing_prefixes": [
        "vidu",
        "vidu/vidu"
      ],
      "supported_backends": [
        "vendor"
      ],
      "supported_modalities": [
        "t2v",
        "i2v",
        "r2v",
        "t2i",
        "i2i"
      ],
      "transport": {
        "audio_input_mode": {
          "vendor": "vidu_vendor_audio_url"
        },
        "image_input_mode": {
          "vendor": "vidu_vendor_image_url"
        },
        "reference_video_input_mode": {
          "vendor": "vidu_vendor_video_url"
        }
      }
    }
  },
  "model_lines": {
    "gemini/gemini-3-pro-image": {
      "backend_env_key": null,
      "credential_sources": {
        "google": [
          "GEMINI_API_KEY"
        ]
      },
      "default_backend": "google",
      "description": "Highest-fidelity Gemini image model; 2K/4K output and the strongest character consistency",
      "display_name": "Nano Banana Pro",
      "docs": {
        "context_hub_doc_ids": [
          "google/gemini-image"
        ],
        "official_snapshot_ids": [
          "google/gemini-image/2026-09-08"
        ]
      },
      "family": "gemini",
      "id": "gemini/gemini-3-pro-image",
      "legacy_model_ids": [
        "gemini-3-pro-image"
      ],
      "modes": [
        "gemini/gemini-3-pro-image#image"
      ],
      "provider": "google",
      "release_stage": "stable",
      "routing_prefixes": [
        "gemini-"
      ],
      "runtime": {
        "google": {
          "api_model_id": "gemini-3-pro-image",
          "gateway": "google"
        }
      },
      "status": "active",
      "supported_backends": [
        "google"
      ],
      "supported_modalities": [
        "t2i",
        "i2i"
      ],
      "transport": {
        "audio_input_mode": {},
        "image_input_mode": {
          "google": "gemini_inline_base64"
        },
        "reference_video_input_mode": {}
      }
    },
    "gemini/gemini-3.1-flash-image": {
      "backend_env_key": null,
      "credential_sources": {
        "google": [
          "GEMINI_API_KEY"
        ]
      },
      "default_backend": "google",
      "description": "Default image model; fast, supports up to 14 reference images including 4 for character consistency",
      "display_name": "Nano Banana 2",
      "docs": {
        "context_hub_doc_ids": [
          "google/gemini-image"
        ],
        "official_snapshot_ids": [
          "google/gemini-image/2026-09-08"
        ]
      },
      "family": "gemini",
      "id": "gemini/gemini-3.1-flash-image",
      "legacy_model_ids": [
        "gemini-3.1-flash-image"
      ],
      "modes": [
        "gemini/gemini-3.1-flash-image#image"
      ],
      "provider": "google",
      "release_stage": "stable",
      "routing_prefixes": [
        "gemini-"
      ],
      "runtime": {
        "google": {
          "api_model_id": "gemini-3.1-flash-image",
          "gateway": "google"
        }
      },
      "status": "active",
      "supported_backends": [
        "google"
      ],
      "supported_modalities": [
        "t2i",
        "i2i"
      ],
      "transport": {
        "audio_input_mode": {},
        "image_input_mode": {
          "google": "gemini_inline_base64"
        },
        "reference_video_input_mode": {}
      }
    },
    "gemini/gemini-3.1-flash-lite-image": {
      "backend_env_key": null,
      "credential_sources": {
        "google": [
          "GEMINI_API_KEY"
        ]
      },
      "default_backend": "google",
      "description": "Cheapest Gemini image model; 0.5K/1K output only",
      "display_name": "Nano Banana 2 Lite",
      "docs": {
        "context_hub_doc_ids": [
          "google/gemini-image"
        ],
        "official_snapshot_ids": [
          "google/gemini-image/2026-09-08"
        ]
      },
      "family": "gemini",
      "id": "gemini/gemini-3.1-flash-lite-image",
      "legacy_model_ids": [
        "gemini-3.1-flash-lite-image"